{
  "acceptanceEnvelopes": "Objective scene membership exact; characteristic feel and unresolved review remain UNC-0002 and UNC-0009.",
  "actions": "Reproduce each scene and state transition under matching camera and world state.",
  "aliases": [],
  "applicability": {
    "candidateKinds": [
      "official"
    ]
  },
  "claimScopes": [
    "fidelity"
  ],
  "dependencies": {
    "caseIds": [],
    "evidenceIds": [
      "EV-a7cbec4ce3631fe0",
      "EV-cfe389c3e5fd1a27"
    ],
    "uncertaintyIds": [
      "UNC-0002",
      "UNC-0009"
    ]
  },
  "executionTiers": [
    "release-candidate"
  ],
  "expectedObservables": "Scene membership, line operations, detail changes, status information, prompts, and ordering match the Reference Build.",
  "fidelity": {
    "classification": "required-behavior",
    "crackSensitivity": "not-applicable",
    "departureIds": [],
    "dimensions": [
      "visuals",
      "content",
      "state",
      "timing"
    ],
    "evidenceIds": [
      "EV-a7cbec4ce3631fe0",
      "EV-cfe389c3e5fd1a27"
    ],
    "materiality": "material",
    "researchProvenance": "display captures and World Geometry Dataset visibility rules"
  },
  "id": "BC-0008",
  "initialState": "Representative surface, underground, vehicle, object-detail, point-detail, status, prompt, and transition states.",
  "reviewRequired": true,
  "schemaVersion": 1,
  "status": "provisional",
  "title": "Wireframe and status presentation",
  "verification": {
    "method": "captured display/state comparison and maintainer review",
    "oracleDiagnosticRequired": true
  },
  "verificationArea": "rendering",
  "version": 1
}
